Unnamed: 0,verified,location,id,url,public_metrics,protected,party,username,name,created_at,description
310,True,"Chatra, Jharkhand",2787891476,https://t.co/Mff50D9PQC,"{'followers_count': 14408, 'following_count': 656, 'tweet_count': 14647, 'listed_count': 32}",False,BJP,SunilSingh_BJP,Sunil Kumar Singh सुनील कुमार सिंह,2014-09-03T12:31:09.000Z,"Chairperson, Committee of Privileges. 2nd Term MP Lok Sabha, Chatra. WHIP BJP, State Vice President, @BJP4Jharkhand."
311,True,"Dehradun, India",2245215054,https://t.co/OiEEQaj1k4,"{'followers_count': 34873, 'following_count': 269, 'tweet_count': 8366, 'listed_count': 18}",False,BJP,sureshbhattbjp,Suresh Bhatt,2013-12-14T07:59:30.000Z,State General Secretary @BJP4UK
312,True,Ichalkaranji,377414975,https://t.co/IEjfodqzbG,"{'followers_count': 7192, 'following_count': 380, 'tweet_count': 9116, 'listed_count': 9}",False,BJP,SureshHalwankar,Suresh Halwankar,2011-09-21T14:56:58.000Z,"Vice President, BJP Maharashtra | Ex MLA"
313,True,"Sambalpur, India",625536118,https://t.co/ObPkstD2C8,"{'followers_count': 37783, 'following_count': 452, 'tweet_count': 6186, 'listed_count': 38}",False,BJP,sureshkpujari,Suresh Pujari,2012-07-03T12:51:59.000Z,"Member of Parliament (Lok-Sabha), Bargarh (ODISHA). Former National Secretary, Bharatiya Janata Party & Saha Pravari of WB @BJP4India"
314,True,"Lucknow , Thana Bhawan",804965481362780160,,"{'followers_count': 131363, 'following_count': 289, 'tweet_count': 12488, 'listed_count': 100}",False,BJP,SureshRanaBJP,Suresh Rana,2016-12-03T08:28:21.000Z,"कैबिनेट मंत्री, विधायक थानाभवन, उत्तर प्रदेश सरकार।"
315,True,"Tamil Nadu, India",46427326,https://t.co/D7xncva1w4,"{'followers_count': 89193, 'following_count': 766, 'tweet_count': 106621, 'listed_count': 193}",False,BJP,SuryahSG,SG Suryah,2009-06-11T16:39:12.000Z,| RSS Swayamsevak | BJP Media Spokesperson | Author of 7 Books | Columnist | Debater | Social Activist |
316,True,"New Delhi, India",219617448,,"{'followers_count': 12951178, 'following_count': 0, 'tweet_count': 6373, 'listed_count': 5502}",False,BJP,SushmaSwaraj,Sushma Swaraj,2010-11-25T11:10:09.000Z,This a/c is a monument in memory of Sushma Swaraj. The ‘RTs’ and ‘likes’ are by @governorswaraj in her fond remembrance.
317,True,New Delhi,60937837,https://t.co/yIFMc7JyFn,"{'followers_count': 10646284, 'following_count': 111, 'tweet_count': 100300, 'listed_count': 4702}",False,BJP,Swamy39,Subramanian Swamy,2009-07-28T15:48:23.000Z,"Rajya Sabha MP, Former Union Cabinet Minister, Harvard Ph.D in Economics; Professor, I give as good as I get"
318,True,"Lucknow, India",2231471756,https://t.co/1k2qnlGxNs,"{'followers_count': 1252782, 'following_count': 435, 'tweet_count': 10838, 'listed_count': 359}",False,BJP,swatantrabjp,Swatantra Dev Singh,2013-12-05T13:25:03.000Z,"अध्यक्ष-भारतीय जनता पार्टी, उत्तर प्रदेश एवं विधान परिषद सदस्य, उत्तर प्रदेश"
319,True,"New Delhi, India",85462891,https://t.co/yHfEVqa54x,"{'followers_count': 851232, 'following_count': 8880, 'tweet_count': 117527, 'listed_count': 994}",False,BJP,TajinderBagga,Tajinder Pal Singh Bagga,2009-10-27T00:53:18.000Z,"National Secretary BJP Youth |             


       Incharge Uttarakhand BJP Youth | Spokesperson BJP Delhi | MLA Candidate Hari Nagar 2020 |"
320,True,Arunachal Pradesh,225649833,https://t.co/OZBDKkAPWD,"{'followers_count': 10405, 'following_count': 309, 'tweet_count': 2475, 'listed_count': 26}",False,BJP,TapirGao,Tapir Gao,2010-12-12T03:17:49.000Z,Member of Parliament (Lok Sabha) Arunachal- East. Arunachal Pradesh
321,True,Dehradun/Delhi. ,13508182,,"{'followers_count': 148335, 'following_count': 1951, 'tweet_count': 44724, 'listed_count': 476}",False,BJP,Tarunvijay,Tarun Vijay தருண் விஜய் भारत के वीर सैनिकों की जय,2008-02-15T08:28:58.000Z,हतो वा प्राप्स्यसि स्वर्गं जित्वा वा भोक्ष्यसे महीम् | तस्मादुत्तिष्ठ कौन्तेय युद्धाय कृतनिश्चय: ||
322,True,"Bengaluru, India",390677061,https://t.co/jHdBizVQTd,"{'followers_count': 1109043, 'following_count': 1201, 'tweet_count': 12194, 'listed_count': 524}",False,BJP,Tejasvi_Surya,Tejasvi Surya,2011-10-14T10:50:33.000Z,National President of BJP Yuva Morcha | Member of Parliament for Bengaluru South Lok Sabha Constituency | Advocate | RT × endorsements | #MadeinIndia
323,True,"Guwahati, India",145874163,,"{'followers_count': 28513, 'following_count': 324, 'tweet_count': 13157, 'listed_count': 33}",False,BJP,TheAshokSinghal,Ashok Singhal,2010-05-20T02:44:03.000Z,"Cabinet Minister, Housing & Urban Affairs, Irrigation, Govt of Assam. Election Co-Inchrge BJP, Manipur, RTs not endorsement | Email : minister.udd@assam.gov.in"
324,True,Bhagyanagar (Hyderabad),541511214,,"{'followers_count': 422565, 'following_count': 26, 'tweet_count': 6952, 'listed_count': 151}",False,BJP,TigerRajaSingh,Raja Singh,2012-03-31T06:51:45.000Z,BJP Floor Leader - MLA - Goshamahal / Official Twitter Account | Follow Office Account @rajasinghoffice
325,True,"Tripura, India",732127554585264128,https://t.co/ynDm9QHDs3,"{'followers_count': 7034, 'following_count': 222, 'tweet_count': 1526, 'listed_count': 3}",False,BJP,tinkuroybjp,Tinku Roy 🇮🇳,2016-05-16T08:36:26.000Z,"Chairman, Tripura Industrial Development Corporation (TIDC) |
General Secretary, BJP Tripura."
326,True,उत्तराखंड ,1853680447,https://t.co/M4IQOuGauX,"{'followers_count': 297297, 'following_count': 111, 'tweet_count': 15519, 'listed_count': 245}",False,BJP,tsrawatbjp,Trivendra Singh Rawat,2013-09-11T07:44:31.000Z,"पूर्व मुख्यमंत्री- उत्तराखण्ड, विधायक (विधानसभा डोईवाला)"
327,True,"New Delhi, India",537465783,https://t.co/FvNB5dxi24,"{'followers_count': 110762, 'following_count': 880, 'tweet_count': 15167, 'listed_count': 138}",False,BJP,upadhyaysbjp,Satish Upadhyay,2012-03-26T17:00:57.000Z,"|| Nationalist || @BJP4India Karyakarta || Ex-President @BJP4Delhi || Vice Chairman, NDMC ||"
328,True,Tadepalligudem,759002871836717057,,"{'followers_count': 4851, 'following_count': 943, 'tweet_count': 5618, 'listed_count': 35}",False,BJP,UrsPMR,Pydikondala Manikyala Rao,2016-07-29T12:29:21.000Z,"State General Secretary at @BJPAndhraPradesh Former Endowments Minister Govt of AP,Former MLA Tadepalligudem"
329,True,India,901132112,https://t.co/cjXqo5t9hJ,"{'followers_count': 159220, 'following_count': 43, 'tweet_count': 7818, 'listed_count': 147}",False,BJP,v_shrivsatish,V Satish,2012-10-24T03:57:14.000Z,
330,True,"Coimbatore, India",974143844,https://t.co/ibwMeUrMe0,"{'followers_count': 239159, 'following_count': 543, 'tweet_count': 14080, 'listed_count': 206}",False,BJP,VanathiBJP,Vanathi Srinivasan,2012-11-27T15:52:59.000Z,National President - @BJPMahilaMorcha | Member of Tamil Nadu Legislative Assembly - Coimbatore South | கோவை தெற்கு தொகுதி தமிழக சட்டமன்ற உறுப்பினர் |
331,True,Surendranagar (Gujarat),478322676,,"{'followers_count': 76742, 'following_count': 1694, 'tweet_count': 22310, 'listed_count': 85}",False,BJP,VarshabenDoshi,Varsha Doshi🇮🇳,2012-01-30T04:44:45.000Z,"Vice President BJP Gujarat State, Ex.M.L.A.-Wadhwan Constituency, Surendranagar (Gujarat) (2007-2017), Best National awardee teacher -2004"
332,True,,1288175774,https://t.co/lbFxiQXfPY,"{'followers_count': 4722187, 'following_count': 218, 'tweet_count': 24472, 'listed_count': 1379}",False,BJP,VasundharaBJP,Vasundhara Raje,2013-03-22T08:53:41.000Z,Official Twitter account of BJP National Vice-President | Former Chief Minister of Rajasthan (Demitted Office on 11th December 2018)
333,True,"Delhi, Mumbai, Aurangabad...",2378726604,https://t.co/KrNuG4kggP,"{'followers_count': 51389, 'following_count': 373, 'tweet_count': 9735, 'listed_count': 0}",False,BJP,VijayaRahatkar,Vijaya Rahatkar,2014-03-08T13:29:48.000Z,National Secretary BJP • I/C of DNH & Daman Diu • Ex Natl Prez of Mahila Morcha • Fmr Chairperson of Maharashtra Women Commission • Founder of Anandi Foundation
334,True,72 Babar Road Bengali market .,459849561,https://t.co/7sqUSDkTlP,"{'followers_count': 548305, 'following_count': 285, 'tweet_count': 23783, 'listed_count': 566}",False,BJP,VijayGoelBJP,Vijay Goel,2012-01-10T03:42:32.000Z,Vice Chairman Gandhi Smriti   Ex Union Sports/parl Min of India with modi ji /Min in PMO with Atal Ji/ 4 times MP /Lottery Crusader/UNESCO Awardee /SRCC Alumni
335,True,"New Delhi, India",726392163660079104,https://t.co/Im6jTgbSuY,"{'followers_count': 9431, 'following_count': 396, 'tweet_count': 16970, 'listed_count': 7}",False,BJP,vijaypalbjp,Vijaypal Singh Tomar,2016-04-30T12:46:02.000Z,"MP R.S. From UP | Co-Incharge @BJP4Odisha | 
Ex President,Kisan Morcha BJP| Member Stnd. Cmte. on Chemical Fertilizer & labour,  Consultative Cmte. of MHRD ।"
336,True,"Uttar Pradesh, India",218036286,https://t.co/SukPPrsIUq,"{'followers_count': 67632, 'following_count': 126, 'tweet_count': 12423, 'listed_count': 66}",False,BJP,vijaypathakbjp,Vijay Bahadur Pathak,2010-11-21T07:09:34.000Z,"प्रदेश उपाध्यक्ष, @BJP4UP { विधायक, MLC-UP } उपसभापति-विशेषाधिकार समिति विधान परिषद, उत्तर प्रदेश सदस्य लोक लेखा समिति, प्रभारी महिला मोर्चा उ.प्र."
337,True,Gandhinagar ,627355202,https://t.co/wQwkRIqvMu,"{'followers_count': 3102393, 'following_count': 248, 'tweet_count': 13744, 'listed_count': 872}",False,BJP,vijayrupanibjp,Vijay Rupani,2012-07-05T12:45:23.000Z,"Former Chief Minister of Gujarat, India"
338,True,Bhopal M.P.,408331737,,"{'followers_count': 44462, 'following_count': 947, 'tweet_count': 23575, 'listed_count': 15}",False,BJP,vijeshlunawat,Vijesh Lunawat,2011-11-09T08:48:17.000Z,In memory of Nationalist BJP Worker.
339,True,"New Delhi & Thane,Maharashtra",44667113,https://t.co/A0Th86mcMJ,"{'followers_count': 165124, 'following_count': 674, 'tweet_count': 18750, 'listed_count': 259}",False,BJP,Vinay1011,Dr. VINAY Sahasrabuddhe,2009-06-04T17:24:58.000Z,"President, @iccr_hq, GoI | MP, Rajya Sabha | Chairman, Parliamentary Standing Committee on EWCY&S | VC, @rmponweb | Tweets personal"
340,True,"नई दिल्ली, भारत",24353544,https://t.co/CV9C0grnLU,"{'followers_count': 47973, 'following_count': 539, 'tweet_count': 30427, 'listed_count': 125}",False,BJP,vinitgoenka,Vinit Goenka,2009-03-14T10:20:48.000Z,"Spokesperson BJP Delhi, Member Governing Council- CRIS, Min of Railways Secretary #CKS Chair #DataSovereignty @ FEAI ,Fmr. Member IT Task Force -MoRTH&S #Author"
341,True,"Bhuj, India",2309409103,,"{'followers_count': 120134, 'following_count': 1595, 'tweet_count': 62953, 'listed_count': 139}",False,BJP,VinodChavdaBJP,Vinod Chavda 🇮🇳,2014-01-25T04:28:21.000Z,"Member of Parliament (Kachchh) & Advocate । General Secretary, BJP Gujarat"
342,True,"Faridabad, Haryana",2754460730,https://t.co/XcKJVsw6rE,"{'followers_count': 44127, 'following_count': 502, 'tweet_count': 8357, 'listed_count': 51}",False,BJP,VipulGoelBJP,Vipul Goel,2014-08-22T09:40:25.000Z,"Former Cabinet Minister, Government of Haryana."
343,True,Shimla,741220385773883392,,"{'followers_count': 5013, 'following_count': 331, 'tweet_count': 2210, 'listed_count': 14}",False,BJP,Virenderbjp,Virender Kashyap,2016-06-10T10:48:06.000Z,"Lok Sabha Ex-MP - Shimla (HP)2009-14&2014-19 for two consecutive terms.
Chairman of HP Scheduled Castes Commission."
344,True,"Thiruvananthapuram, Keralam",78312924,https://t.co/OAt3DnU2Mh,"{'followers_count': 84016, 'following_count': 713, 'tweet_count': 21003, 'listed_count': 149}",False,BJP,VMBJP,V Muraleedharan / വി മുരളീധരൻ,2009-09-29T13:47:24.000Z,"Minister of State for External Affairs & Parliamentary Affairs, GOI🇮🇳| MP(RS),Maharashtra | Former State President @BJP4Keralam| Founder President @NYCSIndia"
345,True,Surat,497766595,,"{'followers_count': 50021, 'following_count': 371, 'tweet_count': 15994, 'listed_count': 70}",False,BJP,zankhanabenbjp,Zankhanaben Patel,2012-02-20T10:19:28.000Z,Official Account of Smt. Zankhana Patel A Bharatiya Janta Party MLA from 168-Choryasi Legislative Assembly Gujarat
346,True,"San Antonio, TX",14802766,https://t.co/bZLTa0Uohc,"{'followers_count': 8978, 'following_count': 5495, 'tweet_count': 79177, 'listed_count': 355}",False,BJP,,"Nan Palmero, MBA",2008-05-16T19:09:49.000Z,Office Furniture Liquidations marketing | Getty award-winning photographer | Tech writer | Marathoner | Black belt | Nan rhymes with John | He/Him
347,True,,3097503906,https://t.co/U20Trq6U2s,"{'followers_count': 1719051, 'following_count': 9, 'tweet_count': 5928, 'listed_count': 871}",False,Congress,PChidambaram_IN,P. Chidambaram,2015-03-19T09:14:38.000Z,"Official account of P. Chidambaram | Member of Parliament, RajyaSabha | Former Finance Minister, GoI | Here for short but serious comment on contemporary issues"
348,True,"Delhi, India",2331591042,,"{'followers_count': 426593, 'following_count': 804, 'tweet_count': 18114, 'listed_count': 188}",False,Congress,NayakRagini,Dr. Ragini Nayak,2014-02-07T09:31:48.000Z,"Mother, Dreamer, Debater..National Spokesperson AICC..Convenor, Foreign Affairs Deptt. AICC..Ex National Gen Secretary,NSUI..Ex President,DUSU..Tweets Personal"
349,True,Katihar & Delhi,68651940,https://t.co/4nknmZd6WF,"{'followers_count': 20834, 'following_count': 2202, 'tweet_count': 9100, 'listed_count': 19}",False,Congress,AlamTauquirJNU,Tauquir Alam,2009-08-25T09:23:38.000Z,"Secretary, Indian National Congress |Incharge @INCUttarPradesh|Former Secretary @IYC|MPhil-JNU|INC MLA Candidate Pranpur 2015 &2020|@NSUI P.Candidate-JNUSU2007"
350,True,"Gujarat, India",769522958486437888,,"{'followers_count': 85555, 'following_count': 348, 'tweet_count': 6337, 'listed_count': 68}",False,Congress,AmitChavdaINC,Amit Chavda,2016-08-27T13:12:25.000Z,"Ex. President of Gujarat Pradesh Congress Committee ( @INCGujarat ). MLA, Gujarat. Tweets are personal. RTs/Like ≠ endorsement."
351,True,"Lucknow, India",78940377,,"{'followers_count': 38272, 'following_count': 7655, 'tweet_count': 10314, 'listed_count': 17}",False,Congress,sadafjafar,Sadaf Jafar,2009-10-01T16:12:17.000Z,"She/Her. 
National Coordinator All India Mahila Congress; ex- spokesperson UPCC; Social Political Human Rights activist; INC Candidate 174 Lucknow Central"
352,True,"Raipur, India",55993926,https://t.co/4jN0mVguOz,"{'followers_count': 18570, 'following_count': 310, 'tweet_count': 13151, 'listed_count': 13}",False,Congress,shaileshINC,Shailesh Trivedi,2009-07-12T02:24:27.000Z,"Chairman, Text Book Corporation, Govt. of Chhattisgarh."
353,True,India,852869933650198529,https://t.co/jEl6ZK6bQn,"{'followers_count': 16210, 'following_count': 218, 'tweet_count': 6177, 'listed_count': 13}",False,Congress,Narwal_inc,Pradeep Narwal,2017-04-14T13:03:32.000Z,"National Secretary, AIl India Congress Committee, Co-incharge @INCUttarPradesh | Former National Coordinator, AICC, |Ambedkarite| JNUite"
354,True,Jammu And Kashmir,3053479483,https://t.co/iBTyaTjE3t,"{'followers_count': 3914, 'following_count': 955, 'tweet_count': 1598, 'listed_count': 1}",False,Congress,SheikhAamir_inc,Sheikh Aamir,2015-03-01T19:35:17.000Z,Politician-Indian National Congress.
355,True,"डेरा बाबा नानक, भारत",1139588035278860288,https://t.co/lDGEP9OpWO,"{'followers_count': 27404, 'following_count': 18, 'tweet_count': 585, 'listed_count': 33}",False,Congress,Sukhjinder_INC,Sukhjinder Singh Randhawa,2019-06-14T17:38:54.000Z,Deputy Chief Minister of Punjab (India)
356,True,"Katihar, India",1157183368594743296,https://t.co/sWHJpcfQ3w,"{'followers_count': 5354, 'following_count': 62, 'tweet_count': 501, 'listed_count': 3}",False,Congress,ShakeelkhanINC,Dr. Shakeel Ahmad Khan,2019-08-02T06:56:29.000Z,"National Secretary-All India Congress Committee, MLA-Kadwa (Katihar), Former DG-Nehru Yuva Kendra Sangathan, Former President- JNUSU,
Views are personal."
357,True,Mumbai,289314809,https://t.co/6GDh1WPGp1,"{'followers_count': 114376, 'following_count': 807, 'tweet_count': 19833, 'listed_count': 104}",False,Congress,sachin_inc,Sachin Sawant सचिन सावंत,2011-04-28T12:34:34.000Z,"B.E - Electronics (hon's)
General Secretary - Maharashtra Pradesh Congress committee, Member-AICC
https://t.co/hBzwFEGctj"
358,True,"Patparganj, Delhi",1522131686,https://t.co/vsI72EnRXV,"{'followers_count': 52369, 'following_count': 633, 'tweet_count': 14693, 'listed_count': 36}",False,Congress,Ch_AnilKumarINC,Anil Chaudhary,2013-06-16T12:55:29.000Z,"President, Delhi Pradesh Congress Committee | Ex AICC Secretary | Ex-MLA, | Ex-Councillor ,Ex- President DPYC & NSUI ,EC DUSU/Pres.Dyal Singh College Union"
359,True,"New Delhi, India",1153045459,https://t.co/51TS85KdYI,"{'followers_count': 8463703, 'following_count': 2353, 'tweet_count': 108420, 'listed_count': 2857}",False,Congress,INCIndia,Congress,2013-02-06T05:45:31.000Z,The Official Twitter Account of India's Most Vibrant Political Movement - The Indian National Congress
360,True,"New Delhi, India",1094645942735855618,https://t.co/SEtVqlka92,"{'followers_count': 4681440, 'following_count': 192, 'tweet_count': 2005, 'listed_count': 1462}",False,Congress,priyankagandhi,Priyanka Gandhi Vadra,2019-02-10T17:15:05.000Z,"General Secretary, Indian National Congress"
361,True,India,16293020,https://t.co/HSCFfD0A2U,"{'followers_count': 1213032, 'following_count': 587, 'tweet_count': 84858, 'listed_count': 599}",False,Congress,IYC,Youth Congress,2008-09-15T07:00:23.000Z,The Official Twitter Account of The Youth Wing of Indian National Congress. RTs are Not Endorsements.
362,True,"5 A, Raisina Road, New Delhi",16323656,https://t.co/otozWNPLdO,"{'followers_count': 473719, 'following_count': 273, 'tweet_count': 38451, 'listed_count': 302}",False,Congress,nsui,NSUI,2008-09-17T04:19:44.000Z,Official handle of National Students' Union of India. Country's largest & most responsible student organization. https://t.co/ineqMxlWj5
363,True,"12, Tughlak Lane, New Delhi",3171712086,https://t.co/pSFdno9O8q,"{'followers_count': 20094471, 'following_count': 278, 'tweet_count': 6069, 'listed_count': 4442}",False,Congress,RahulGandhi,Rahul Gandhi,2015-04-25T06:39:15.000Z,This is the official account of Rahul Gandhi | Member of the Indian National Congress| Member of Parliament
364,True,"Gujarat, India",756108545859448832,https://t.co/ZqEr5aXWUg,"{'followers_count': 1820126, 'following_count': 299, 'tweet_count': 4383, 'listed_count': 592}",False,Congress,HardikPatel_,Hardik Patel,2016-07-21T12:48:19.000Z,Proud Indian Patriot. Social and Political Activist. Working President of Gujarat Congress. Committed to a better India.
365,True,Delhi,371730289,https://t.co/wAwE8d6dUC,"{'followers_count': 1249839, 'following_count': 127, 'tweet_count': 34620, 'listed_count': 1360}",False,Congress,digvijaya_28,digvijaya singh,2011-09-11T12:03:57.000Z,"Ex General Secretary of All India Congress Committee , Ex CM Madhya Pradesh Ex President MPCC and Member Rajya Sabha retweets are not the endorsement!"
366,True,"Bhopal, India",3257583379,https://t.co/wqQbJY3tF9,"{'followers_count': 1062049, 'following_count': 226, 'tweet_count': 61062, 'listed_count': 287}",False,Congress,INCMP,MP Congress,2015-06-27T08:06:59.000Z,Official Twitter account Of Madhya Pradesh Congress Committee (MPCC) RT≠Endorsement
367,True,"Uttar Pradesh, India.",1906974517,https://t.co/bx15llsgFM,"{'followers_count': 514060, 'following_count': 555, 'tweet_count': 46228, 'listed_count': 273}",False,Congress,INCUttarPradesh,UP Congress,2013-09-26T06:44:40.000Z,Official Twitter Account of Uttar Pradesh Congress.
368,True,"Indore, Madhya Pradesh",223080911,https://t.co/gAUZ1CMLlU,"{'followers_count': 915024, 'following_count': 297, 'tweet_count': 38666, 'listed_count': 243}",False,Congress,jitupatwari,Jitu Patwari,2010-12-05T09:57:24.000Z,Working President @INCMP | MLA Rau (Indore) | Congress Ka Sipahi
369,True,"Madhya Pradesh, India",724205574565466112,https://t.co/ltcuDhMbKW,"{'followers_count': 1264255, 'following_count': 80, 'tweet_count': 6801, 'listed_count': 436}",False,Congress,OfficeOfKNath,Kamal Nath,2016-04-24T11:57:18.000Z,President MP Congress । Ex. Chief Minister of Madhya Pradesh । 9 times Member of Parliament from Chhindwara ।
370,True,,336088096,https://t.co/VwAQTXM2Ol,"{'followers_count': 275015, 'following_count': 1868, 'tweet_count': 35653, 'listed_count': 203}",False,Congress,rohanrgupta,Rohan Gupta,2011-07-15T18:34:26.000Z,"Chairman, Social Media Department ,
Indian National Congress"
371,True,"Bhopal, Madhya Pradesh",2616817675,https://t.co/12UgVxfbJp,"{'followers_count': 247604, 'following_count': 374, 'tweet_count': 5765, 'listed_count': 63}",False,Congress,JVSinghINC,Jaivardhan Singh,2014-07-11T06:14:39.000Z,"MLA, Raghogarh | Ex Minister for Urban Development and Housing, Madhya Pradesh"
372,True,Tamkuhi/Lucknow,2860160384,https://t.co/phbRImQ8ME,"{'followers_count': 215504, 'following_count': 560, 'tweet_count': 21567, 'listed_count': 113}",False,Congress,AjayLalluINC,Ajay Kumar Lallu,2014-10-17T11:48:19.000Z,"President-Uttar Pradesh Congress Committee | MLA
2nd Term from Tamkuhi Raj | Ex. Student Union President Kisan PG College | RTs not Endorsement"
373,True,India,2393674370,https://t.co/yb0ErEtPIr,"{'followers_count': 775209, 'following_count': 135, 'tweet_count': 3525, 'listed_count': 214}",False,Congress,RajBabbar23,Raj Babbar,2014-03-17T03:25:26.000Z,Account managed by Office of Shri Raj Babbar.
374,True,"Bhopal, India",399437937,https://t.co/xJXXwBT8QU,"{'followers_count': 234670, 'following_count': 870, 'tweet_count': 87280, 'listed_count': 111}",False,Congress,KunalChoudhary_,Kunal Choudhary,2011-10-27T14:06:23.000Z,"MLA Kalapipal (M.P.) | Former President, Madhya Pradesh Youth Congress @IYCMadhya | Facebook ― KunalChoudharyINC | Instagram ― kunalchoudhary_inc"
375,True,Uttarakhand ,2431635092,https://t.co/RGtDt7L7IS,"{'followers_count': 384460, 'following_count': 1690, 'tweet_count': 27625, 'listed_count': 181}",False,Congress,harishrawatcmuk,Harish Rawat,2014-04-07T07:13:11.000Z,"Former Chief Minister Uttarakhand &  CWC Member, AICC https://t.co/WGidzAgfWm"
376,True,Mumbai,20427494,https://t.co/k2AOeOeAmI,"{'followers_count': 433836, 'following_count': 1060, 'tweet_count': 32523, 'listed_count': 372}",False,Congress,sanjaynirupam,Sanjay Nirupam,2009-02-09T10:41:02.000Z,A Congressman.
377,True,"Dalhousie, India",869520978480582658,https://t.co/SVxfz7QLrv,"{'followers_count': 35607, 'following_count': 57, 'tweet_count': 7163, 'listed_count': 31}",False,Congress,AshaKumariINC,Asha Kumari,2017-05-30T11:48:50.000Z,"6th term MLA from Dalhousie, H.P.

Former Education Minister- H.P Govt,
Former- AICC Incharge for @INCPunjab & @INCChandigarh.

RTs do not imply endorsement"
378,True,"Jharkhand, India.      ",1610087438,https://t.co/1zJFchJFA5,"{'followers_count': 29977, 'following_count': 1017, 'tweet_count': 15335, 'listed_count': 59}",False,Congress,pranavINC,pranav jha,2013-07-21T08:39:05.000Z,"AICC Secretary, I/c, Communications, Indian National Congress"
379,True,"Patna and New Delhi, India",2584552812,https://t.co/6AkcDEXSMG,"{'followers_count': 3454409, 'following_count': 116, 'tweet_count': 1759, 'listed_count': 1002}",False,Congress,kanhaiyakumar,Kanhaiya Kumar,2014-06-23T20:46:00.000Z,Former President of JNU Students’ Union; Author- ‘From Bihar to Tihar’ https://t.co/iW6d7jEUxW
380,True,MLA SHRI CHAMKAUR SAHIB PUNJAB,213223745,,"{'followers_count': 239040, 'following_count': 41, 'tweet_count': 1653, 'listed_count': 92}",False,Congress,CHARANJITCHANNI,Charanjit S  Channi,2010-11-08T09:58:09.000Z,Chief Minister of Punjab
381,True,New Delhi,288623057,https://t.co/ZIS9vJbpeS,"{'followers_count': 41348, 'following_count': 111, 'tweet_count': 4034, 'listed_count': 77}",False,Congress,RavneetBittu,Ravneet Singh Bittu,2011-04-27T05:31:24.000Z,Member of Parliament - 16th Lok Sabha (Ludhiana) Punjab and 15th Lok Sabha (Anandpur Sahib) Punjab.
382,True,"Barmer-Jaisalmer, Rajasthan",1722765919,https://t.co/TEcFPsIw6y,"{'followers_count': 128371, 'following_count': 106, 'tweet_count': 4386, 'listed_count': 47}",False,Congress,Barmer_Harish,Harish Chaudhary,2013-09-02T15:57:54.000Z,"AICC in charge Punjab & Chandigargh ,MLA from Baytoo, Former National Secretary at AICC, Ex. MP Barmer-Jaisalmer (2009-14) I RT's are Not Endorsements."
383,True,"Ladnun, Nagaur, Rajasthan",1597719445,,"{'followers_count': 194134, 'following_count': 188, 'tweet_count': 38567, 'listed_count': 71}",False,Congress,MukeshBhakar_,Mukesh Bhakar,2013-07-16T06:31:33.000Z,"MLA, Ladnun, Rajasthan | Ex. President (Elected), RPYC |
Ex National Sec., NSUI |
Ex NSUI President, Rajasthan |  https://t.co/hU1jOmkheJ"
384,True,"Parbatsar, India",4838791572,,"{'followers_count': 166877, 'following_count': 383, 'tweet_count': 3865, 'listed_count': 32}",False,Congress,RamniwasGawriya,Ramniwas Gawriya,2016-01-31T07:50:58.000Z,"MLA Parbatsar, Rajasthan || National Delegate NSUI Rajasthan || Former President Rajasthan University Student Union(Law College)"
385,True,"Gudamalani, India",1003201143000817664,https://t.co/KcFSjel6h0,"{'followers_count': 113104, 'following_count': 96, 'tweet_count': 2887, 'listed_count': 26}",False,Congress,Hemaram_INC,Hemaram Choudhary,2018-06-03T09:06:05.000Z,"Cabinet Minister Govt. Of Rajasthan 
(Forest || Environment & Climate Change) || 6th Term MLA From Gudamalani Constituency ||"
