Unnamed: 0,verified,location,id,url,public_metrics,protected,party,username,name,created_at,description
77,True,"Mumbai, India Nagpur",777049636469149696,https://t.co/MadXWgGF4X,"{'followers_count': 5658, 'following_count': 168, 'tweet_count': 5922, 'listed_count': 9}",False,BJP,AnilSole1,Prof Anil Sole,2016-09-17T07:40:45.000Z,"MLC & State Executive Memb
 @BJP4Maharashtra | Chairman Shikshak Sahakari Bank | Former President AICM | Former Mayor Nagpur City | President Fortune Foundation"
78,True,Dehradun ,107680763,,"{'followers_count': 15221, 'following_count': 1405, 'tweet_count': 16139, 'listed_count': 66}",False,BJP,anupamtr,Anupam Trivedi,2010-01-23T10:43:29.000Z,Nationalist. Entrepreneur. Views are personal. RTs are endorsement.
79,True,"Lucknow, India",843386813171490817,,"{'followers_count': 489066, 'following_count': 31, 'tweet_count': 10112, 'listed_count': 125}",False,BJP,anupmajaisbjp,Anupma Jaiswal,2017-03-19T09:01:00.000Z,"पूर्व राज्यमंत्री (स्वतंत्र प्रभार) बेसिक शिक्षा, बाल विकास पुष्टाहार | राजस्व | वित्त |MOS Basic Edu | Child Dev & Nutrition(Ind) | @UPGovt | MLA, Bahraich"
80,True,Uttar Pradesh,1921946424,https://t.co/TEufeeMVmc,"{'followers_count': 159016, 'following_count': 139, 'tweet_count': 7401, 'listed_count': 139}",False,BJP,ArunSinghbjp,Arun Singh,2013-10-01T02:26:34.000Z,"National General Secretary , BJP ☆ Member of Parliament, Rajya Sabha ☆ State Incharge (Prabhari) Rajasthan / Karnataka BJP ☆ Secretary, SPMRF ☆ Incharge BJP HQ,"
81,True,"Shimla/Mumbai, India",120123219,https://t.co/7L3bXbttFx,"{'followers_count': 47650, 'following_count': 881, 'tweet_count': 18284, 'listed_count': 54}",False,BJP,AshishSainram,Ashish Chauhan,2010-03-05T14:46:52.000Z,"A student of India's Students’ Movement; National Organising Secretary, ABVP @ABVPVoice"
82,True,"New Delhi, India",202552918,,"{'followers_count': 56763, 'following_count': 2164, 'tweet_count': 40435, 'listed_count': 58}",False,BJP,AshokGoelBJP,Ashok Goel,2010-10-14T09:06:57.000Z,Chartered Accountant | Vice President - BJP4Delhi | Delhi BJP MLA Candidate - Model Town 2013 | RT not endorsement | Opinions totally personal |
83,True,"Gadchiroli, New Delhi",838666041416953856,https://t.co/OyH2M17ly1,"{'followers_count': 20518, 'following_count': 350, 'tweet_count': 8394, 'listed_count': 16}",False,BJP,AshokNeteMP,Ashok Nete 🇮🇳,2017-03-06T08:22:20.000Z,"National General Secretary, BJP ST Morcha | 2nd Term Member of Parliament, Gadchiroli Lok Sabha (MH) | Former MLA, Maharashtra (1999-2009)"
84,False,"New Delhi, India",2228272268,,"{'followers_count': 1658, 'following_count': 161, 'tweet_count': 410, 'listed_count': 0}",False,BJP,AshwiniBJP,Ashwini Upadhyay,2013-12-03T13:16:08.000Z,"Let's make a United Integrated Developed & Delighted India, Free from Corruption Crime Casteism Communalism Linguism Regionalism Separatism Radicalism& Nepotism"
85,True,Jalgaon,1621623402,,"{'followers_count': 11391, 'following_count': 1238, 'tweet_count': 8830, 'listed_count': 50}",False,BJP,atnanapatilmp,A T Nana Patil M P,2013-07-26T00:52:08.000Z,"BJP Member of Parliament-Jalgaon, A servant to society and work for building the Nation."
86,True,on Mother Earth,979795484,,"{'followers_count': 32969, 'following_count': 1265, 'tweet_count': 29372, 'listed_count': 74}",False,BJP,Avadhutwaghbjp,Avadhut Wagh अवधूत वाघ,2012-11-30T05:11:56.000Z,"BE (Mech), DMS,MFM
VJTI & JBIMS Alumnus.
#ModiBhakta
Humble to get followback from my living God PM Shri @narendramodi ji & @nitin_gadkari ji 
#HinduRashtra"
87,True,"Maval, India Mumbai",2873236182,https://t.co/Q65iQBJcQ7,"{'followers_count': 3156, 'following_count': 365, 'tweet_count': 2513, 'listed_count': 5}",False,BJP,BalaBhegade,Bala Bhegade- बाळा भेगडे,2014-10-23T12:40:33.000Z,Former Minister of State
88,True,India,369570414,https://t.co/RPFeWdRGqb,"{'followers_count': 9604, 'following_count': 184, 'tweet_count': 17152, 'listed_count': 32}",False,BJP,balbirpunj,Balbir Punj,2011-09-07T15:47:28.000Z,Commentator on #Social and #Political Issues. Has been @BJP4India member of #Parliament for two terms.
89,True,"Bijnor, India",721327670563315712,,"{'followers_count': 2224, 'following_count': 142, 'tweet_count': 2506, 'listed_count': 10}",False,BJP,BharatendraBJP,Bharatendra Singh,2016-04-16T13:21:33.000Z,Official Twitter profile of Lok Sabha MP Bijnor. BJP Karyakarta
90,True,Ahmedabad,443541186,,"{'followers_count': 58274, 'following_count': 272, 'tweet_count': 13152, 'listed_count': 76}",False,BJP,bharatpandyabjp,Bharat Pandya,2011-12-22T08:36:44.000Z,"Spokesperson, BJP Gujarat (Since 2016 to 2020)
General Secretary, BJP Gujarat (Since 2013 to 2015)
MLA,Dhandhuka Assembly.(Since 1998 to 2007)"
91,True,"Kandivali East, Mumbai",726417797048373248,https://t.co/Sl5JZwipoE,"{'followers_count': 81523, 'following_count': 381, 'tweet_count': 10542, 'listed_count': 69}",False,BJP,BhatkhalkarA,Atul Bhatkhalkar,2016-04-30T14:27:53.000Z,BJP MLA from Kandivali East Constituency | RSS Swayamsevak | Ex Sangh Pracharak | Nationalist
92,True,"Gandhinagar, India",2547602874,https://t.co/RSsV1gU4dT,"{'followers_count': 170984, 'following_count': 23, 'tweet_count': 11891, 'listed_count': 116}",False,BJP,bhikhubhaidbjp,Bhikhubhai Dalsaniya,2014-06-05T07:40:53.000Z,State General Secretary (Organization) of @BJP4Bihar
93,True,"Sagar, India",725260382625894402,,"{'followers_count': 135720, 'following_count': 129, 'tweet_count': 10085, 'listed_count': 48}",False,BJP,bhupendrasingho,Bhuppendra Siingh,2016-04-27T09:48:44.000Z,"Minister of Urban Development and Housing, Govt of Madhya Pradesh. Member of Legislative Assembly-Khurai. Ex MP-Sagar. Karyakarta, BJP"
94,True,"Andhra Pradesh, India",3308534123,https://t.co/6m1aGgKIfO,"{'followers_count': 104826, 'following_count': 295, 'tweet_count': 18980, 'listed_count': 153}",False,BJP,BJP4Andhra,BJP ANDHRA PRADESH,2015-06-04T18:25:06.000Z,"Official Twitter Handle of the Bharatiya Janata Party (BJP), Andhra Pradesh."
95,True,,741171197342187521,https://t.co/hTr3Ks8Tob,"{'followers_count': 43871, 'following_count': 44, 'tweet_count': 3168, 'listed_count': 87}",False,BJP,BJP4AnN,BJP Andaman Nicobar,2016-06-10T07:32:38.000Z,Official Twitter account of the Bharatiya Janata Party (BJP) Andaman and Nicobar
96,True,Itanagar,1853325038,https://t.co/yOQmYfithP,"{'followers_count': 61323, 'following_count': 188, 'tweet_count': 32729, 'listed_count': 89}",False,BJP,BJP4Arunachal,BJP ArunachalPradesh,2013-09-11T04:42:24.000Z,"BHARATIYA JANATA PARTY,  Arunachal Pradesh"
97,True,"Hengrabari, Guwahati, Assam",1858339356,https://t.co/5Wr6wUOrhQ,"{'followers_count': 145177, 'following_count': 187, 'tweet_count': 25965, 'listed_count': 170}",False,BJP,BJP4Assam,BJP Assam Pradesh,2013-09-12T19:45:19.000Z,The official Twitter Handle of BJP Assam Pradesh.
98,True,"Kolkata, West Bengal",2984417534,https://t.co/KtNN5Jhve3,"{'followers_count': 370611, 'following_count': 155, 'tweet_count': 48170, 'listed_count': 286}",False,BJP,BJP4Bengal,BJP Bengal,2015-01-15T17:38:20.000Z,Official Twitter handle of BJP West Bengal (BJPBengal)
99,True,,758215424622391296,https://t.co/7CO9y2NxUo,"{'followers_count': 363056, 'following_count': 67, 'tweet_count': 40937, 'listed_count': 211}",False,BJP,BJP4Bihar,BJP Bihar,2016-07-27T08:20:18.000Z,Official Twitter Account of BJP Bihar
100,True,,1698414426,https://t.co/DeAulP4dmV,"{'followers_count': 119442, 'following_count': 165, 'tweet_count': 41085, 'listed_count': 134}",False,BJP,BJP4CGState,BJP Chhattisgarh,2013-08-25T07:26:36.000Z,Official account of BJP Chhattisgarh State
101,True,"Chandigarh, India",1562806872,https://t.co/ASCDFHpJQD,"{'followers_count': 50769, 'following_count': 518, 'tweet_count': 12841, 'listed_count': 104}",False,BJP,BJP4Chandigarh,BJP Chandigarh,2013-07-02T10:37:46.000Z,"The Official Account of BJP Chandigarh · Join us towards making Ek Bharat, Shreshth Bharat!"
102,True,"Chhapra, India",912215065192939520,https://t.co/VuQ3dvFbNg,"{'followers_count': 5044, 'following_count': 100, 'tweet_count': 4947, 'listed_count': 1}",False,BJP,BJP4Chapra,BJP SARAN (Chapra),2017-09-25T07:19:54.000Z,"The official Twitter Account of BJP Saran Dist. Bihar  भारतीय जनता पार्टी, जिला: सारण बिहार का अधिकारिक ट्विटर अकाउंट 
https://t.co/x6NUJF5E7g
Sansad Control Room: 18003456222"
103,True,,741180647624974336,https://t.co/yCdzrcOlM4,"{'followers_count': 42471, 'following_count': 86, 'tweet_count': 4841, 'listed_count': 69}",False,BJP,BJP4DamanDiu,BJP Daman Diu,2016-06-10T08:10:11.000Z,Official Twitter account of the Bharatiya Janata Party (BJP) Daman and Diu
104,True,New Delhi,337065278,https://t.co/rUU6FEKGb3,"{'followers_count': 1103545, 'following_count': 72, 'tweet_count': 86187, 'listed_count': 659}",False,BJP,BJP4Delhi,BJP Delhi,2011-07-17T11:45:02.000Z,Official account of BJP Delhi State. https://t.co/QFhgjaxeAi
105,True,"Dadra And Nagar Haveli, India",741176277592219648,https://t.co/1JD0AGb0MJ,"{'followers_count': 43159, 'following_count': 36, 'tweet_count': 17000, 'listed_count': 73}",False,BJP,BJP4DnNH,BJP Dadra and Nagar Haveli & Daman and Diu,2016-06-10T07:52:49.000Z,Official Twitter account of the Bharatiya Janata Party (BJP) Dadra and Nagar Haveli & Daman and Diu
106,True,,758216347486720000,https://t.co/VuEjuLf3Js,"{'followers_count': 69918, 'following_count': 52, 'tweet_count': 6283, 'listed_count': 107}",False,BJP,BJP4Goa,BJP Goa,2016-07-27T08:23:59.000Z,Official BJP Goa state twitter account
107,True,"Gandhinagar,Gujarat",385909720,https://t.co/TsL5VMyTG2,"{'followers_count': 1543133, 'following_count': 153, 'tweet_count': 59677, 'listed_count': 759}",False,BJP,BJP4Gujarat,BJP Gujarat,2011-10-06T10:40:27.000Z,Official Twitter account of Bharatiya Janata Party (BJP) Gujarat Pradesh
108,True,"Haryana, India",287602729,https://t.co/YMta5pM1c0,"{'followers_count': 233578, 'following_count': 209, 'tweet_count': 51275, 'listed_count': 170}",False,BJP,BJP4Haryana,Haryana BJP,2011-04-25T09:43:19.000Z,"Official Twitter Handle of Bharatiya Janata Party #BJP, #Haryana."
109,True,Shimla,775379648,https://t.co/yCdapNakRN,"{'followers_count': 144654, 'following_count': 276, 'tweet_count': 49023, 'listed_count': 183}",False,BJP,BJP4Himachal,BJP Himachal Pradesh,2012-08-23T07:11:37.000Z,Official Twitter Account of BJP Himachal Pradesh. भारतीय जनता पार्टी हिमाचल प्रदेश।
110,True,"6-A, Deen Dayal Upadhyay Marg,",207809313,https://t.co/cjXqo5byqb,"{'followers_count': 17940418, 'following_count': 3, 'tweet_count': 228250, 'listed_count': 4393}",False,BJP,BJP4India,BJP,2010-10-26T02:19:07.000Z,"Official Twitter account of the Bharatiya Janata Party (BJP), world's largest political party. भारतीय जनता पार्टी (भाजपा)

https://t.co/d1IYtw5taF"
111,True,RANCHI JHARKHAND,2807393784,https://t.co/zHkIYoXv2F,"{'followers_count': 152359, 'following_count': 200, 'tweet_count': 40584, 'listed_count': 107}",False,BJP,BJP4Jharkhand,BJP JHARKHAND,2014-09-13T12:46:59.000Z,Official twitter account of BJP Jharkhand. Follow us on facebook @BJP4Jharkhand
112,True,Jammu & Kashmir,1864685238,https://t.co/xqcf4hdeTZ,"{'followers_count': 86430, 'following_count': 222, 'tweet_count': 52380, 'listed_count': 196}",False,BJP,BJP4JnK,BJP Jammu & Kashmir,2013-09-14T19:21:16.000Z,"Official Twitter Account of Bharatiya Janata Party, Jammu & Kashmir | Join BJP@ https://t.co/84RHmlpJTF"
113,True,"Karnataka, India",25123615,https://t.co/3v4PW7W0Oo,"{'followers_count': 453868, 'following_count': 168, 'tweet_count': 41398, 'listed_count': 438}",False,BJP,BJP4Karnataka,BJP Karnataka,2009-03-18T18:31:05.000Z,Official account of BJP Karnataka
114,True,,2297438462,https://t.co/mxdV7XZzjq,"{'followers_count': 99047, 'following_count': 86, 'tweet_count': 13452, 'listed_count': 160}",False,BJP,BJP4Keralam,BJP KERALAM,2014-01-18T07:16:36.000Z,Official Twitter account of the Bharatiya Janata Party (BJP) Kerala
115,True,"Lakshadweep, India",753133585767489536,https://t.co/uOAqSRf0WL,"{'followers_count': 43703, 'following_count': 38, 'tweet_count': 2218, 'listed_count': 73}",False,BJP,BJP4Lakshadweep,BJP Lakshadweep,2016-07-13T07:46:54.000Z,Official Twitter account of the Bharatiya Janata Party (BJP) Lakshadweep
116,True,महाराष्ट्र,532895350,https://t.co/8D9RTDzbPQ,"{'followers_count': 456425, 'following_count': 156, 'tweet_count': 72147, 'listed_count': 384}",False,BJP,BJP4Maharashtra,भाजपा महाराष्ट्र,2012-03-22T06:56:02.000Z,Official Twitter Account of BJP Maharashtra महाराष्ट्र भाजपाचे अधिकृत ट्विटर खातं 🙏🏻 https://t.co/P7zgrrKgbD
117,True,,753125213206970368,https://t.co/HBXKtppO8l,"{'followers_count': 65026, 'following_count': 52, 'tweet_count': 9702, 'listed_count': 101}",False,BJP,BJP4Manipur,BJP Manipur,2016-07-13T07:13:38.000Z,Official Twitter account of the Bharatiya Janata Party (BJP) Manipur State.
118,True,,758217021918179328,https://t.co/q4ucRcuxYI,"{'followers_count': 56749, 'following_count': 46, 'tweet_count': 2264, 'listed_count': 82}",False,BJP,BJP4Meghalaya,BJP Meghalaya,2016-07-27T08:26:40.000Z,Official BJP Meghalaya twitter account
119,True,,758217962176282624,https://t.co/RXYYKPj3hQ,"{'followers_count': 31508, 'following_count': 46, 'tweet_count': 3084, 'listed_count': 83}",False,BJP,BJP4Mizoram,BJP Mizoram,2016-07-27T08:30:23.000Z,Official BJP Mizoram Twitter Account
120,True,"Bhopal, MadhyaPradesh",1618490684,https://t.co/IvDIBQqlqH,"{'followers_count': 951862, 'following_count': 256, 'tweet_count': 40484, 'listed_count': 277}",False,BJP,BJP4MP,BJP MadhyaPradesh,2013-07-24T19:43:54.000Z,"Official Account of Bharatiya Janata Party, Madhya Pradesh, @BJP4MP"
121,True,"Nagaland, India",753128018764242946,https://t.co/1mOx2dESIU,"{'followers_count': 61230, 'following_count': 40, 'tweet_count': 12471, 'listed_count': 90}",False,BJP,BJP4Nagaland,BJP Nagaland,2016-07-13T07:24:47.000Z,Official Twitter account of the Bharatiya Janata Party (BJP) Nagaland
122,True,Odisha,1013243604,https://t.co/yd5ZLIiNue,"{'followers_count': 168013, 'following_count': 303, 'tweet_count': 92300, 'listed_count': 199}",False,BJP,BJP4Odisha,BJP Odisha,2012-12-15T13:51:39.000Z,"Official Twitter account of BJP (Odisha Pradesh) 
Facebook- https://t.co/L2jCzIo1oZ"
123,True,,753131004483760129,https://t.co/kOBnbmyakl,"{'followers_count': 23878, 'following_count': 50, 'tweet_count': 7457, 'listed_count': 62}",False,BJP,BJP4Puducherry,BJP Puducherry,2016-07-13T07:36:38.000Z,Official Twitter account of the Bharatiya Janata Party (BJP) Puducherry
124,True,"Chandigarh, India",1848033674,https://t.co/oDhciNfbjf,"{'followers_count': 73618, 'following_count': 482, 'tweet_count': 14865, 'listed_count': 130}",False,BJP,BJP4Punjab,BJP PUNJAB,2013-09-09T16:10:54.000Z,Twitter account of the Punjab Bharatiya Janata Party (BJP).
125,True,"Jaipur, India",1320141312,https://t.co/M38lOEOR5B,"{'followers_count': 718643, 'following_count': 126, 'tweet_count': 41505, 'listed_count': 349}",False,BJP,BJP4Rajasthan,BJP Rajasthan,2013-04-01T11:33:49.000Z,Official Twitter Handle of BJP Rajasthan | https://t.co/PymF3laB6T
126,True,,758219947067731968,https://t.co/vaIG1HSeww,"{'followers_count': 51164, 'following_count': 51, 'tweet_count': 2925, 'listed_count': 80}",False,BJP,BJP4Sikkim,BJP Sikkim,2016-07-27T08:38:17.000Z,Official Twitter Account of BJP Sikkim
127,True,"Tamil Nadu, India",396707695,https://t.co/I8I5XqVlQ4,"{'followers_count': 450399, 'following_count': 253, 'tweet_count': 28180, 'listed_count': 334}",False,BJP,BJP4TamilNadu,BJP Tamilnadu,2011-10-23T17:18:18.000Z,Official Twitter Account of Tamil Nadu Unit of Bharathiya Janata Party. தமிழ்நாடு பாரதிய ஜனதா கட்சியின் அதிகாரப்பூர்வ ட்விட்டர் கணக்கு.
128,True,,758217523506667520,https://t.co/c9fYT4vsdT,"{'followers_count': 190682, 'following_count': 79, 'tweet_count': 23345, 'listed_count': 145}",False,BJP,BJP4Telangana,BJP Telangana,2016-07-27T08:28:39.000Z,Official BJP Telangana Account
129,True,"Tripura, India",758219083833831424,https://t.co/Dc6SDsGffW,"{'followers_count': 81037, 'following_count': 149, 'tweet_count': 17165, 'listed_count': 94}",False,BJP,BJP4Tripura,BJP Tripura,2016-07-27T08:34:51.000Z,Official Twitter Account of BJP Tripura
130,True,Dehradun,2229508381,https://t.co/jt4NyQIsGy,"{'followers_count': 138056, 'following_count': 121, 'tweet_count': 39253, 'listed_count': 156}",False,BJP,BJP4UK,BJP Uttarakhand,2013-12-04T08:01:10.000Z,"Official Twitter Account of Bharatiya Janata Party, Uttarakhand."
131,True,"Lucknow, India",2220938808,https://t.co/wZFGfP9nRk,"{'followers_count': 3356447, 'following_count': 111, 'tweet_count': 70698, 'listed_count': 775}",False,BJP,BJP4UP,BJP Uttar Pradesh,2013-11-29T06:15:22.000Z,"Official Twitter account of Bharatiya Janata Party, Uttar Pradesh. Connect us on Instagram: https://t.co/qnRbexk8J6"
132,True,Tripura,725003596811620353,,"{'followers_count': 225128, 'following_count': 215, 'tweet_count': 20743, 'listed_count': 251}",False,BJP,BjpBiplab,Biplab Kumar Deb,2016-04-26T16:48:22.000Z,"Chief Minister of Tripura, India"
133,True,Ranchi,2187991476,https://t.co/3QXm4gFNyY,"{'followers_count': 33143, 'following_count': 149, 'tweet_count': 24210, 'listed_count': 22}",False,BJP,bjpcpsingh,CP Singh,2013-11-11T08:50:02.000Z,🇮🇳 1st - Party 2nd - Self Last | Consecutive 6th Term BJP MLA From Ranchi (1996-Present)| Ex Minister | Former Speaker | Limca Book of Record Holder for PGMS.
134,True,"Karamsad, Anand, India",1608548923,https://t.co/o3kmwv2ZE1,"{'followers_count': 21639, 'following_count': 872, 'tweet_count': 24620, 'listed_count': 36}",False,BJP,bjpdilippatel,Dilip Patel 🇮🇳,2013-07-20T15:55:02.000Z,BJP Karyakarta | Former Member of Parliament (Loksabha) - Anand  (Gujarat) | Former Minister Gov. of Gujarat | Former M.L.A ANAND (Gujarat)
135,True,"Lucknow, India",4678601036,https://t.co/ehn1fZMbu3,"{'followers_count': 379776, 'following_count': 444, 'tweet_count': 18215, 'listed_count': 160}",False,BJP,bjpdrmahendra,Dr. Mahendra Singh,2015-12-30T15:17:14.000Z,"Minister of Jal Shakti, Government of Uttar Pradesh. Member of Legislative Council (MLC)."
136,True,,486711396,https://t.co/7m82oLSCJh,"{'followers_count': 729589, 'following_count': 199, 'tweet_count': 221501, 'listed_count': 742}",False,BJP,BJPLive,BJP LIVE,2012-02-08T15:46:07.000Z,The Internet TV initiative by the BJP.
137,True,"Mumbai, India",2411128315,https://t.co/vrXxP79hJd,"{'followers_count': 13902, 'following_count': 176, 'tweet_count': 4667, 'listed_count': 41}",False,BJP,bjpprakashmehta,Prakash Mehta,2014-03-25T14:43:54.000Z,"Ex-Cabinet Minister of Housing, Labour, Mining, Heavy Industry Department, GoM | Former Guardian Minister of Raigad District | Ex 6 times MLA from Ghatkopar (E)"
138,False,India,2418493507,,"{'followers_count': 27320, 'following_count': 112, 'tweet_count': 7570, 'listed_count': 53}",False,BJP,bjpramswaroop,Ram Swaroop Sharma,2014-03-30T05:01:16.000Z,"Member of Parliament From Mandi, Himachal Pradesh https://t.co/8XohClM6AC…"
139,True,,194017030,https://t.co/j2tulbkPH9,"{'followers_count': 318450, 'following_count': 417, 'tweet_count': 39440, 'listed_count': 294}",False,BJP,bjpsamvad,भाजपा सम्वाद,2010-09-23T06:37:13.000Z,Instagram : https://t.co/KlVL2nro49
140,True,India,1664992976,https://t.co/vx5E5wfAsp,"{'followers_count': 58119, 'following_count': 1239, 'tweet_count': 3303, 'listed_count': 64}",False,BJP,BJPSanjayJoshi,Sanjay Vinayak Joshi,2013-08-12T12:41:18.000Z,"Former National General Secretary (Organization),
 BHARATIYA JANATA PARTY"
141,True,"New Delhi, India",1943733722,https://t.co/7Qglr6IBAo,"{'followers_count': 35868, 'following_count': 400, 'tweet_count': 16264, 'listed_count': 81}",False,BJP,BJPShivPShukla,Shiv Pratap Shukla,2013-10-07T10:49:45.000Z,"Former Union Minister of State (Finance) Government of India, Chief Whip (Rajya Sabha), Member Parliament (Rajya Sabha)"
142,True,Kaushambi,2436753176,https://t.co/Nuyts2UUNZ,"{'followers_count': 59425, 'following_count': 359, 'tweet_count': 36534, 'listed_count': 60}",False,BJP,BJPVinodSonkar,Vinod Sonkar,2014-04-10T09:11:31.000Z,सांसद-कौशाम्बी लोकसभा उप्र। राष्ट्रीय मंत्री- भारतीय जनता पार्टी। सभापति- लोकसभा संसदीय आचार समिति। त्रिपुरा प्रभारी- भाजपा।
143,True,New Delhi,53075131,https://t.co/LAvL2PQjiY,"{'followers_count': 536145, 'following_count': 127, 'tweet_count': 30393, 'listed_count': 269}",False,BJP,BJYM,BJYM,2009-07-02T14:21:18.000Z,"Official Twitter handle of Bharatiya Janata Yuva Morcha (BJYM), the largest youth political organization of the world. https://t.co/Vlag3Pdanv"
144,True,"New Delhi, India",1065563383,https://t.co/cjXqo5t9hJ,"{'followers_count': 374475, 'following_count': 331, 'tweet_count': 5000, 'listed_count': 246}",False,BJP,blsanthosh,B L Santhosh,2013-01-06T12:16:02.000Z,"National General Secretary (Org), BJP"
145,True,"Bengaluru, India",54936590,https://t.co/GuAHEKmhFh,"{'followers_count': 1059804, 'following_count': 155, 'tweet_count': 7718, 'listed_count': 519}",False,BJP,BSYBJP,B.S. Yediyurappa,2009-07-08T15:58:06.000Z,Former Chief Minister of Karnataka
146,True,Chimur Nagpur Mumbai,2913325168,https://t.co/J2k8b9Nkot,"{'followers_count': 2886, 'following_count': 306, 'tweet_count': 7110, 'listed_count': 9}",False,BJP,Bunty_Bhangdiya,Bunty Bhangdiya (Kirti Kumar),2014-12-10T05:56:09.000Z,Member of legislative assembly (MLA)| Chimur constituency | Member of @BJP4Maharashtra | Dist-Chandrapur |Maharashtra.
147,True,New Delhi,391901721,https://t.co/knOhzgKd8P,"{'followers_count': 489442, 'following_count': 935, 'tweet_count': 16333, 'listed_count': 420}",False,BJP,byadavbjp,Bhupender Yadav,2011-10-16T08:20:10.000Z,"Union Cabinet Minister for Environment, Forest & Climate Change; and Labour & Employment || MP (RS) || Links, retweets not endorsements."
148,True,"Gujarat, India",1617123242,,"{'followers_count': 538873, 'following_count': 213, 'tweet_count': 6506, 'listed_count': 136}",False,BJP,ChaudhryShankar,Shankar Chaudhary,2013-07-24T07:23:55.000Z,"BJP Karyakarta | Chairman, Banas Dairy, Asia’s largest cooperative dairy | Vice Chairman, Gujarat State Cooperative Bank"
149,True,"Maharashtra, India",2760043614,https://t.co/exQ37TTbud,"{'followers_count': 230245, 'following_count': 221, 'tweet_count': 14291, 'listed_count': 114}",False,BJP,ChDadaPatil,Chandrakant Patil,2014-08-23T19:53:38.000Z,President of Maharashtra BJP
150,True,Chittorgarh,2676090294,https://t.co/7xPbuPNj2U,"{'followers_count': 46461, 'following_count': 364, 'tweet_count': 44631, 'listed_count': 47}",False,BJP,cpjoshiBJP,C. P. Joshi,2014-07-24T07:33:29.000Z,Member of Parliament (Lok Sabha) from Chittorgarh (Raj.)    https://t.co/m7MNvNhGng
151,True,"Surat, Gujrat",305603067,https://t.co/Ed0B35xQc5,"{'followers_count': 344014, 'following_count': 530, 'tweet_count': 71901, 'listed_count': 586}",False,BJP,CRPaatil,C R Paatil,2011-05-26T14:06:55.000Z,"President @BJP4Gujarat, Member of Parliament-Navsari"
152,False,"Sravasti,Uttar Pradesh",117647696,https://t.co/cHQmnXtgaT,"{'followers_count': 8683, 'following_count': 83, 'tweet_count': 4809, 'listed_count': 18}",False,BJP,daddanmishra,Daddan Mishra,2010-02-26T04:58:40.000Z,"EX-Member of Parliament - Shravasti. BJP LEADER. Ex Minister, Ex MLA from Shravasti, Uttar Pradesh. Social Worker, entrepreneur."
153,True,"Vadodara, Gujarat, India",152163609,https://t.co/HzwwG072aC,"{'followers_count': 42738, 'following_count': 523, 'tweet_count': 22105, 'listed_count': 48}",False,BJP,dangarbharat,Dr. Bharat Dangar,2010-06-05T06:58:46.000Z,"Co-Spoke Person, Gujarat BJP I Ex Director, Bank Of Baroda | Ex Mayor, Vadodara City | Ex President of BJP Vadodara City | Ast. Professor, MSU"
154,True,"Surat, Gujarat, India",143388401,https://t.co/QHAwWSW5Uq,"{'followers_count': 134042, 'following_count': 540, 'tweet_count': 21534, 'listed_count': 269}",False,BJP,DarshanaJardosh,Darshana Jardosh,2010-05-13T10:02:34.000Z,"Minister of State for Railways & Textiles, Government of India | Member of Parliament, Surat Lok Sabha"
155,True,India,3261056648,,"{'followers_count': 72607, 'following_count': 214, 'tweet_count': 7761, 'listed_count': 100}",False,BJP,Dattatreya,Bandaru Dattatreya,2015-06-30T08:38:20.000Z,Governor Of Haryana.
156,True,"Maharashtra State,India",137780376,https://t.co/lp0xQtxPzJ,"{'followers_count': 5208022, 'following_count': 51, 'tweet_count': 46183, 'listed_count': 1718}",False,BJP,Dev_Fadnavis,Devendra Fadnavis,2010-04-27T18:58:50.000Z,Maharashtra’s Sevak
157,True,"Nadiad, Gujarat",591850159,https://t.co/TPjtFTUmfT,"{'followers_count': 60355, 'following_count': 415, 'tweet_count': 18203, 'listed_count': 106}",False,BJP,devusinh,Devusinh Chauhan,2012-05-27T13:59:11.000Z,"• Minister Of State For Ministry of Communications (Govt.Of India)
• Member of Parliament - Kheda (Gujarat)"
158,True,Ahmednagar,2175963973,https://t.co/RWDeiZ7Gmv,"{'followers_count': 3586, 'following_count': 463, 'tweet_count': 4355, 'listed_count': 14}",False,BJP,DilipGandhiMP,Dilip Gandhi,2013-11-05T12:15:06.000Z,Ex.Member of Parliament from Ahmednagar Constituency(Served Three Terms) | Former Union MoS for Shipping | Ex.President - BJP Ahmednagar City.
