Unnamed: 0,verified,location,id,url,public_metrics,protected,party,username,name,created_at,description
159,True,"Paschim Banga, India",4743651972,https://t.co/GDklHOyYxh,"{'followers_count': 359418, 'following_count': 118, 'tweet_count': 9530, 'listed_count': 186}",False,BJP,DilipGhoshBJP,Dilip Ghosh,2016-01-11T15:03:33.000Z,BJP - National Vice President || Member of Parliament from Medinipur II Ex- MLA
160,True,Delhi/Odisha/India,1897514666,https://t.co/ykxdxuBRel,"{'followers_count': 1716988, 'following_count': 1703, 'tweet_count': 55094, 'listed_count': 993}",False,BJP,dpradhanbjp,Dharmendra Pradhan,2013-09-23T14:45:38.000Z,"Minister of Education and Minister of Skill Development & Entrepreneurship, Government of India. Views personal. RTs not endorsement"
161,True,"Ralegaon, India",760886225997791232,https://t.co/MadXWgGF4X,"{'followers_count': 6557, 'following_count': 351, 'tweet_count': 3568, 'listed_count': 12}",False,BJP,drashokuike_mla,Dr.Ashok Uike,2016-08-03T17:13:07.000Z,"Member of Legislative Assembly Ralegaon Constituency
| President BJP S.T.Morcha Maharashtra State

| Ex- Minister of Tribal Devlopment Government of Maharashtra"
162,True,Bengaluru,2885971046,https://t.co/ddatU3rPYY,"{'followers_count': 264876, 'following_count': 328, 'tweet_count': 17925, 'listed_count': 129}",False,BJP,drashwathcn,Dr. Ashwathnarayan C. N.,2014-11-01T07:38:45.000Z,"ಜನಸೇವಕ | Minister for Higher Education; IT & BT, Science & Technology; Skill Development, Entrepreneurship & Livelihood | Former DyCM of Karnataka"
163,True,"Uttar Pradesh, Lucknow",4208714065,https://t.co/cjXqo5t9hJ,"{'followers_count': 2318793, 'following_count': 279, 'tweet_count': 6855, 'listed_count': 523}",False,BJP,drdineshbjp,Dr Dinesh Sharma BJP,2015-11-12T04:29:51.000Z,"Deputy Chief Minister Uttar Pradesh, Ex National Vice President of BJP , Ex Incharge of BJP Gujarat,Ex Mayor of Lucknow"
164,True,"Nandurbar, India",2894041754,,"{'followers_count': 13512, 'following_count': 224, 'tweet_count': 976, 'listed_count': 34}",False,BJP,DrHeena_Gavit,Dr. Heena Gavit,2014-11-08T18:53:07.000Z,"BJP National Spokesperson | Member of Parliament (Nandurbar, Maharashtra) | MD (Medicine), LLB | Traveller | Nature & Music Lover"
165,True,Rajkot,480506865,https://t.co/sWh78Er9sY,"{'followers_count': 10516, 'following_count': 741, 'tweet_count': 22424, 'listed_count': 37}",False,BJP,DrKathiria,Dr.Vallabh Kathiria,2012-02-01T15:39:38.000Z,"Chairman - Rashtriya Kamdhenu Aayog, Govt of India. Ex Minister for Health & Family Welfare; HRD And Heavy Industry & PE;Govt.of India & Member of Parliament"
166,True,"Hyderabad, India",1565619564,https://t.co/qRO49OmcuJ,"{'followers_count': 66973, 'following_count': 337, 'tweet_count': 13111, 'listed_count': 63}",False,BJP,drlaxmanbjp,Dr K Laxman,2013-07-03T12:23:36.000Z,National President - OBC Morcha @BJP4India | Former State President @BJP4Telangana | Ex-MLA Musheerabad Assembly Constituency.
167,True,Chandauli,2436708865,https://t.co/T7LMslJwEf,"{'followers_count': 450912, 'following_count': 679, 'tweet_count': 18812, 'listed_count': 336}",False,BJP,DrMNPandeyMP,Dr. Mahendra Nath Pandey,2014-04-10T08:14:40.000Z,"मंत्री, भारी उद्योग मंत्रालय, भारत सरकार, Minister for Heavy Industries, Govt. of India. सांसद - लोकसभा चन्दौली, MP - Lok Sabha Chandauli."
168,True,Karnavati,1110805057,,"{'followers_count': 410696, 'following_count': 324, 'tweet_count': 35886, 'listed_count': 124}",False,BJP,DrRutvij,Dr. Rutvij Patel,2013-01-22T06:47:31.000Z,"Co-Spokesperson, BJP Gujarat |
Ex-President, Bharatiya Janta Yuva Morcha (BJYM), Gujarat"
169,True,India,710127509946236928,https://t.co/bVVlUpHLE1,"{'followers_count': 31735, 'following_count': 795, 'tweet_count': 10145, 'listed_count': 78}",False,BJP,fskulaste,Faggan Singh Kulaste,2016-03-16T15:36:06.000Z,"Union Minister of State in the Ministry of Steel and Ministry of Rural Development | 6th term Lok Sabha MP -Mandla, Madhya Pradesh | Office-@FSKulasteOffice"
170,True,Dehradun,2318873012,https://t.co/3FvxJX7SmY,"{'followers_count': 25851, 'following_count': 132, 'tweet_count': 12228, 'listed_count': 56}",False,BJP,ganeshjoshibjp,Ganesh Joshi,2014-01-30T13:11:05.000Z,"Minister of Soldier Welfare, Industrial Development, MSME, Khadi and Village Industries, Govt. of Uttarakhand.

MLA (@bjp4Mussoorie),  Military Man 🇮🇳"
171,True,"Satna, Madhya Pradesh, India",2526662419,https://t.co/OsewTgiDQ7,"{'followers_count': 46668, 'following_count': 294, 'tweet_count': 25802, 'listed_count': 51}",False,BJP,GaneshSingh_in,Ganesh Singh,2014-05-27T05:45:43.000Z,Member of Parliament (LS)4th Term Satna (M.P)| Secretary-BJP Parliamentary Party| Ex-Zila Panchayat  Member & President Satna.
172,True,"New Delhi, India",59112159,https://t.co/T2DyphKRNL,"{'followers_count': 526188, 'following_count': 388, 'tweet_count': 28432, 'listed_count': 226}",False,BJP,gauravbh,Gaurav Bhatia गौरव भाटिया 🇮🇳,2009-07-22T12:29:43.000Z,Senior Advocate - Supreme Court | National Spokesperson BJP| Former Hony. Secretary SCBA & Addi Advocate General UP| https://t.co/4oBoU4Mo1g…
173,True,,99448420,https://t.co/7rajwVpNn0,"{'followers_count': 12279437, 'following_count': 141, 'tweet_count': 5018, 'listed_count': 3884}",False,BJP,GautamGambhir,Gautam Gambhir,2009-12-26T07:02:14.000Z,Former Cricketer. Member of Honourable Parliament (East Delhi).
174,True,"Bihar, India",1642669674,https://t.co/Tc6jiFmjb9,"{'followers_count': 1661070, 'following_count': 1304, 'tweet_count': 34379, 'listed_count': 788}",False,BJP,girirajsinghbjp,Shandilya Giriraj Singh,2013-08-03T12:03:49.000Z,| Nationalist | BJP Karyakarta | MP for Begusarai । Minister for Rural Development (@MoRD_GOI ) and Minister for Panchayati Raj ( @mopr_goi )।
175,True,"Nagpur, India Mumbai",885193506662363136,https://t.co/ipP6xKESHs,"{'followers_count': 3569, 'following_count': 174, 'tweet_count': 2354, 'listed_count': 11}",False,BJP,GirishVyasBJP,Girish Vyas,2017-07-12T17:45:52.000Z,Former MLC @BJP4Maharashtra | Spokesperson Maharashtra BJP | Former Corporator | Director - Nagpur Nagarik Sahakari Bank Ltd
176,True,noida,321380775,https://t.co/5hFxSBKoP8,"{'followers_count': 32683, 'following_count': 834, 'tweet_count': 35327, 'listed_count': 73}",False,BJP,gopalkagarwal,Gopal Krishna Agarwal,2011-06-21T13:46:26.000Z,"BJP National Spokesperson, CA, BCom(H) MA(Eco), Economic Thinker, Author, Political Activist,ExDirector IICA, Bank of Baroda & NEEPCO,Director BPCL & ICSI(IIP)"
177,True,"Jodhpur, Rajasthan",2371536685,,"{'followers_count': 456762, 'following_count': 538, 'tweet_count': 20166, 'listed_count': 324}",False,BJP,gssjodhpur,Gajendra Singh Shekhawat,2014-03-04T07:13:03.000Z,"Union Minister of Jal Shakti, Government of India. MP (Lok Sabha) Jodhpur."
178,True,,1054143836,https://t.co/3FZ8wYpDsg,"{'followers_count': 163785, 'following_count': 446, 'tweet_count': 18227, 'listed_count': 136}",False,BJP,Gupta_vijender,Vijender Gupta,2013-01-02T04:01:01.000Z,"MLA (Rohini) Member, DDA.Ex President Delhi BJP,Ex LOP Delhi,Ex Chairman MCD Standing Committee. SRCC Alumnus."
179,True,"Karol Bagh, New Delhi",2204739805,,"{'followers_count': 23354, 'following_count': 1234, 'tweet_count': 16208, 'listed_count': 21}",False,BJP,guptaravinder71,Ravinder Gupta 🇮🇳,2013-11-20T11:24:44.000Z,"BJP MLA Candidate MatiyaMahal 2020

Gen Sec BJP Delhi State 2017

Mayor North Delhi -2015

Deputy Mayor North Delhi -2013 

Chairmen Works Com Mcd 2012"
180,True,INDIA,67802523,https://t.co/C3gY4mZZBt,"{'followers_count': 126352, 'following_count': 53, 'tweet_count': 8755, 'listed_count': 340}",False,BJP,GVLNRAO,GVL Narasimha Rao,2009-08-22T03:28:20.000Z,"Member of Parliament (Rajya Sabha), BJP & Member, Standing Committee on Finance; Consultative Committee on External Affairs, Acclaimed Psephologist & Author"
181,True,"Basti, India",776685723906895872,https://t.co/zRc5weGY9B,"{'followers_count': 83444, 'following_count': 1612, 'tweet_count': 8535, 'listed_count': 37}",False,BJP,HarishD_BJP,Harish Dwivedi,2016-09-16T07:34:41.000Z,"राष्ट्रीय सचिव,भाजपा | सांसद,बस्ती(उ० प्र०) | सह प्रभारी, भाजपा बिहार | अध्यक्ष, याचिका समिति(लोक सभा) |
इंस्ट्रग्राम https://t.co/f2hzeUEDaA"
182,True,Delhi,1722800118,,"{'followers_count': 39408, 'following_count': 816, 'tweet_count': 13280, 'listed_count': 46}",False,BJP,HarishKhuranna,Harish Khurana,2013-09-02T16:35:03.000Z,@bjp4India karyakarta|@bjp4Delhi Spokesperson | Also Incharge of BJP Delhi Media Relations|Proud to be son of late shri Madan Lal Khurana
183,True,"Chennai, India",3306088051,https://t.co/bD1PFq2ePX,"{'followers_count': 647964, 'following_count': 619, 'tweet_count': 8587, 'listed_count': 296}",False,BJP,HRajaBJP,H Raja,2015-08-04T13:21:12.000Z,"Official Twitter Account of Shri.H Raja | Nationalist | Ex-MLA from Karaikudi Assembly Constituency , Tamil Nadu."
184,True,"GANDHINAGAR, GUJARAT ",416542960,,"{'followers_count': 182095, 'following_count': 957, 'tweet_count': 11860, 'listed_count': 124}",False,BJP,IKJadejaBJP,I.K.JADEJA,2011-11-19T20:56:08.000Z,"🔸Former Cabinet Minister,Government of Gujarat 🔸Former Vice President,state Bjp 🔸Tweets Personal,retweets r not Endorsement 🔸"
185,True,"Gandhinagar, Gujarat.",613537399,,"{'followers_count': 477818, 'following_count': 473, 'tweet_count': 7105, 'listed_count': 154}",False,BJP,imBhupendrasinh,Bhupendrasinh Chudasama,2012-06-20T15:42:37.000Z,"MLA - Dholka, Gujarat, India"
186,True,Ahmedabad,285101065,https://t.co/TsL5VMhiOu,"{'followers_count': 250030, 'following_count': 4088, 'tweet_count': 49671, 'listed_count': 131}",False,BJP,iPankajShukla,Dr. Pankaj Shukla,2011-04-20T14:43:39.000Z,"Former Convener, IT & Social Media Department, @BJP4Gujarat, Ex. President @BJYM_Ahmedabad, Ex ABVP, Senate & Syndicate Member, Gujarat University."
187,True,"Bardoli, India",729749154356826112,https://t.co/nLkW8WmsaC,"{'followers_count': 27459, 'following_count': 845, 'tweet_count': 7172, 'listed_count': 27}",False,BJP,IshwarParmarMLA,𝐈𝐬𝐡𝐰𝐚𝐫 𝐏𝐚𝐫𝐦𝐚𝐫,2016-05-09T19:05:31.000Z,"MLA-169 Bardoli Constituency,EX-Cabinet Minister,Department of Social Justice & Empowerment (2017) @Bjp4Gujarat."
188,True,"Malleshwaram, Bangalore, India",1225924610,https://t.co/utDzOHmUKd,"{'followers_count': 761399, 'following_count': 31, 'tweet_count': 31294, 'listed_count': 139}",False,BJP,Jaggesh2,ನವರಸನಾಯಕ ಜಗ್ಗೇಶ್,2013-02-27T19:55:57.000Z,"ಶ್ರೀಕೃಷ್ಣಂವಂದೆಜಗದ್ಗುರು|RSS/Ex-MLA/MLC/ACTOR|ರಾಯರಮಗ|ಸ್ವಾಭಿಮಾನಿ ಕನ್ನಡಿಗ|
ರಾಯರು,ಅಪ್ಪಅಮ್ಮ ನನ್ನದೇವರು|ಕನ್ನಡ ದೇವರುಗಳಿಗೆ ಈ ಗುಬ್ಬಚ್ಚಿಗೂಡು @BJP4karnataka #SPOKESPERSON"
189,True,"Rewa, India",4034543546,,"{'followers_count': 32150, 'following_count': 124, 'tweet_count': 6822, 'listed_count': 25}",False,BJP,Janardan_BJP,Janardan Mishra,2015-10-27T10:39:30.000Z,"Member Of Parliament , Rewa (M.P.)
सांसद, रीवा (म.प्र.)"
190,True,"Rajasthan, India",2989732699,https://t.co/9IdWOFOupF,"{'followers_count': 20028, 'following_count': 1072, 'tweet_count': 10437, 'listed_count': 19}",False,BJP,JaunapuriaSS,Sukhbir Jaunapuria,2015-01-19T10:46:34.000Z,"Official Twitter account of #BJP MP 2nd Term from Tonk-Sawai Madhopur, #facebook https://t.co/gO0DgvMX4A…"
191,True,"Assam, India",141610194,https://t.co/yhkAA9nPYV,"{'followers_count': 74956, 'following_count': 105, 'tweet_count': 6868, 'listed_count': 47}",False,BJP,jayanta_malla,Jayanta Mallabaruah,2010-05-08T14:43:44.000Z,"MLA, Nalbari LAC and Political Secretary to Hon'ble Chief Minister of Assam"
192,True,India,17850606,,"{'followers_count': 343670, 'following_count': 445, 'tweet_count': 28980, 'listed_count': 566}",False,BJP,jayantsinha,Jayant Sinha,2008-12-03T22:03:04.000Z,"BJP Member of Parliament - Hazaribagh. Former venture capitalist; passionate about India, technology, tennis & cricket."
193,True,Delhi,2940878702,https://t.co/tZdxq1LUHg,"{'followers_count': 145467, 'following_count': 354, 'tweet_count': 6357, 'listed_count': 68}",False,BJP,jhaprabhatbjp,Prabhat Jha,2014-12-23T14:38:49.000Z,| BJP Karyakarta |
194,True,"Vododara, India",85101713,https://t.co/3M3Kk67eCH,"{'followers_count': 15277, 'following_count': 1598, 'tweet_count': 29759, 'listed_count': 62}",False,BJP,jigar_inamdar,Dr Jigar Inamdar,2009-10-25T15:27:58.000Z,"Regional Director, ICCR, Govt. of India. Senate+Syndicate Member-MSU Baroda/Ex.G.Sec,Gujarat YouthBJP. Honoured to be followed by PM Narendrabhai Modi"
195,True,"Gujarat, India",482203628,https://t.co/DyRQ8auXOP,"{'followers_count': 472513, 'following_count': 632, 'tweet_count': 47341, 'listed_count': 214}",False,BJP,jitu_vaghani,Jitu Vaghani,2012-02-03T16:56:35.000Z,"Cabinet Minister of Education, Science & Technology - Govt. of Gujarat | MLA Bhavnagar West | Former President of @BJP4Gujarat"
196,True,New Delhi,2990611686,https://t.co/x5wqGBwMdl,"{'followers_count': 2772148, 'following_count': 220, 'tweet_count': 28123, 'listed_count': 1540}",False,BJP,JPNadda,Jagat Prakash Nadda,2015-01-20T04:22:40.000Z,राष्ट्रीय अध्यक्ष - भारतीय जनता पार्टी @bjp4india
197,True,Delhi,439154852,https://t.co/KbWcYpvKgp,"{'followers_count': 1717104, 'following_count': 2097, 'tweet_count': 30920, 'listed_count': 487}",False,BJP,KailashOnline,Kailash Vijayvargiya,2011-12-17T12:36:56.000Z,"National General Secretary of #BJP, Active Worker & a Proud Indian who continuously strives for development.   Central Observer for West Bengal."
198,True,"Uttar Pradesh, India",254937160,https://t.co/EOPjUCmKNN,"{'followers_count': 337830, 'following_count': 5, 'tweet_count': 26842, 'listed_count': 338}",False,BJP,KalrajMishra,कलराज मिश्र (Kalraj Mishra),2011-02-20T09:34:50.000Z,"राज्यपाल, राजस्थान Governor, Rajasthan"
199,True,Ferozepur,1512642913,https://t.co/K9RlebUY1b,"{'followers_count': 8516, 'following_count': 472, 'tweet_count': 1502, 'listed_count': 34}",False,BJP,kamalsharmabjp,Kamal Sharma,2013-06-13T06:58:17.000Z,"Former President,Bhartiya Janata Party,Punjab FB Page : https://t.co/U6SVhLNpEB"
200,True,"Maharashtra, India",111240477,https://t.co/pZ5JJSUj13,"{'followers_count': 30722, 'following_count': 303, 'tweet_count': 10899, 'listed_count': 48}",False,BJP,keshavupadhye,Keshav Upadhye,2010-02-04T07:20:02.000Z,"Divergent opinions are signs of a vibrant democracy. I respect different opinions, though I may not b in agreement with them. Chief Spokesperson,@BJPMaharashtra"
201,True,Muktainagar,2413574533,https://t.co/1ott8yaWjT,"{'followers_count': 48553, 'following_count': 200, 'tweet_count': 6130, 'listed_count': 43}",False,BJP,khadseraksha,Raksha Khadse,2014-03-27T03:31:54.000Z,Member of Parliament | Raver Lok Sabha Maharashtra | 2nd Term | Secretary @BJP4Maharashtra | Passionate About Women Empowerment & Child Education |
202,True,,122959195,,"{'followers_count': 1393063, 'following_count': 832, 'tweet_count': 168232, 'listed_count': 759}",False,BJP,khushsundar,KhushbuSundar or NakhatKhan,2010-03-14T13:48:45.000Z,"Proud Indian!! To Opposition troll hatchery team, keep following n keep entertaining! 👍 #NationalExecutiveCommitteeMember.@BJP4India . #BJP4INDIA #Modi4India"
203,True,"Mumbai, Maharashtra",348988523,https://t.co/YqtEoaefeV,"{'followers_count': 336190, 'following_count': 23, 'tweet_count': 5729, 'listed_count': 267}",False,BJP,KiritSomaiya,Kirit Somaiya,2011-08-05T10:23:52.000Z,"BJP Former Member of Parliament Chartered Accountant , Ph.D."
204,True,"Chandigarh, New Delhi",2395668313,https://t.co/Zqdt3sJJi8,"{'followers_count': 428386, 'following_count': 1248, 'tweet_count': 3183, 'listed_count': 331}",False,BJP,KirronKherBJP,Kirron Kher,2014-03-18T05:17:44.000Z,"Member Of Parliament, Chandigarh. Actor."
205,True,"Hyderabad, Telangana.",160509668,https://t.co/lfVXm30XsF,"{'followers_count': 307196, 'following_count': 764, 'tweet_count': 30498, 'listed_count': 421}",False,BJP,kishanreddybjp,G Kishan Reddy,2010-06-28T11:05:12.000Z,"Union Minister For Culture, Tourism And Development Of North Eastern Region (DoNER), Government of India | MP - Secunderabad"
206,True,Faridabad,2941721204,,"{'followers_count': 134755, 'following_count': 583, 'tweet_count': 15746, 'listed_count': 190}",False,BJP,KPGBJP,Krishan Pal Gurjar,2014-12-24T10:01:25.000Z,"Minister of State for Power and Heavy Industries, Government of India.

Member of Parliament- Faridabad."
207,True,"Nagpur, India",882811280599519232,https://t.co/8D9RTDQNeq,"{'followers_count': 6494, 'following_count': 149, 'tweet_count': 4453, 'listed_count': 11}",False,BJP,krishnakhopde,Krishna Khopde,2017-07-06T03:59:45.000Z,3rd Term MLA (54) East Nagpur  | Former Deputy Mayor Nagpur MC | Former City President BJP | Former Standing Committee Chairman NMC
208,True,"New Delhi, India",3236480554,https://t.co/3nsEGGH7yg,"{'followers_count': 96091, 'following_count': 1131, 'tweet_count': 36563, 'listed_count': 65}",False,BJP,kuljeetschahal,Kuljeet Singh Chahal 🇮🇳,2015-05-05T17:52:18.000Z,||Nationalist ||General Secretary @bjp4delhi ||National Council Member @bjp4India || Love Challenges In life|| #NamoAppAbhiyaan || RT Not Endorsement ||
209,True,"अयोध्या, भारत",2537171173,https://t.co/7vC7pBZ2Oy,"{'followers_count': 44665, 'following_count': 476, 'tweet_count': 24574, 'listed_count': 29}",False,BJP,LalluSinghBJP,Lallu Singh,2014-05-31T10:20:10.000Z,"Ayodhya Member of Parliament (LS) (2014,19) | 
MLA 5 Terms (Ayodhya 1991-2012)।
Member Standing Committee on Petroleum & Natural Gas | RTs≠Endorsement |"
210,True,"Mumbai, India",755306754926313472,https://t.co/8kDRZTN0il,"{'followers_count': 20014, 'following_count': 554, 'tweet_count': 6664, 'listed_count': 19}",False,BJP,LavekarBharati,Dr. Bharati Lavekar,2016-07-19T07:42:18.000Z,"MLA of Versova, Mumbai, Maharashtra | Bharatiya Janata party 
M.A., M.Phil, B.J, Ph.D. (Uniform Civil Code)"
211,True,"Meerut, India",1366219417,https://t.co/BQfuolqQvV,"{'followers_count': 35250, 'following_count': 286, 'tweet_count': 3697, 'listed_count': 65}",False,BJP,LKBajpaiBJP,Dr. Laxmikant Bajpai,2013-04-20T05:10:57.000Z,"Former State President, Bhartiya Janta Party, Uttar Pradesh. Chairperson, Joining and Screening Committee BJP Uttar Pradesh, National Executive Member, BJP."
212,True,Delhi,373410448,,"{'followers_count': 1742645, 'following_count': 405, 'tweet_count': 10666, 'listed_count': 1114}",False,BJP,M_Lekhi,Meenakashi Lekhi,2011-09-14T14:46:13.000Z,"Union Minister of State for External Affairs & Culture I Member of Parliament, New Delhi LS I Lawyer and Social Activist"
213,True,"Maharashtra, India",779170926332108800,https://t.co/YYhLLITOfs,"{'followers_count': 17053, 'following_count': 206, 'tweet_count': 5064, 'listed_count': 14}",False,BJP,Madhavbhandari_,Madhav Bhandari,2016-09-23T04:09:59.000Z,Vice President - BJP Maharashtra | Former Chief State Spokeperson- BJP Maharashtra | Director Vilasrao Salunke Adhysan (Rambhau Mhalgi Prabodhini)
214,True,India ,67854459,https://t.co/RABeug4AcO,"{'followers_count': 26816, 'following_count': 984, 'tweet_count': 12815, 'listed_count': 60}",False,BJP,Madhukeshwar,Madhukeshwar Desai,2009-08-22T09:21:15.000Z,"CEO, MCIA | National Vice President, BJP Youth Wing | Vice President MSBA | Lawyer | Tech junkie | Petrol head | Wanderlust | Nanos gigantum humeris insidentes"
215,True,"Pune,India",1667857622,https://t.co/EnX9vcRPJk,"{'followers_count': 23810, 'following_count': 948, 'tweet_count': 5094, 'listed_count': 53}",False,BJP,madhurimisal,Madhuri Misal,2013-08-13T13:47:29.000Z,Member Of Legislative Assembly For #Parvati #Pune. WHIP BJP MAHARASHTRA. RT does not constitute endorsement
216,True,"New Delhi, India",425973946,https://t.co/kJeIcy5jlB,"{'followers_count': 133918, 'following_count': 656, 'tweet_count': 39835, 'listed_count': 229}",False,BJP,MaheishGirri,Maheish Girri,2011-12-01T17:40:33.000Z,"| https://t.co/DFnYkLwABo | https://t.co/j0LnZexIhP | Ex MP East Delhi, Ex National Secretary BJP"
217,True,"New Delhi, India",2766064128,,"{'followers_count': 261819, 'following_count': 112, 'tweet_count': 11602, 'listed_count': 312}",False,BJP,Manekagandhibjp,Maneka Sanjay Gandhi,2014-08-25T11:40:24.000Z,"Member of Parliament (LS), Sultanpur. Author. Environmentalist. Animal Rights Activist. Founder & Chairperson: People for Animals. SOS: gandhim@nic.in"
218,True,Patna,1403858670,,"{'followers_count': 465889, 'following_count': 318, 'tweet_count': 15815, 'listed_count': 113}",False,BJP,mangalpandeybjp,Mangal Pandey,2013-05-05T02:16:40.000Z,"Minister of Health, Govt. Of Bihar,  Ex - State President  BJP BIHAR, MLC"
219,True,"Delhi, India",3314976162,https://t.co/yRb20MgZwk,"{'followers_count': 1589064, 'following_count': 1225, 'tweet_count': 15471, 'listed_count': 369}",False,BJP,ManojTiwariMP,Manoj Tiwari 🇮🇳,2015-08-14T12:29:04.000Z,"Actor, Singer, Music Director,Television Presenter,Politician.2nd Term Member of Parliament Delhi (North-East)& Former Delhi President of Bharatiya Janata Party"
220,True,"Gandhinagar, Delhi",432697203,https://t.co/vrNwVsmqnm,"{'followers_count': 449930, 'following_count': 718, 'tweet_count': 16734, 'listed_count': 399}",False,BJP,mansukhmandviya,Dr Mansukh Mandaviya,2011-12-09T17:41:55.000Z,"#GreenMP | Minister of Health and Family Welfare; Chemicals and Fertilizers, GoI l Doctorate in Political Science | @OfficeOf_MM |
https://t.co/kmq2nEDQKf"
221,True,"Pune, India",2689206181,https://t.co/cX8W1vgIUq,"{'followers_count': 37486, 'following_count': 94, 'tweet_count': 3385, 'listed_count': 49}",False,BJP,Medha_kulkarni,Dr. Medha Kulkarni,2014-07-29T04:53:18.000Z,"Ex-MLA, Kothrud Assembly Constituency,
3 times corporator, PMC,
National Vice President - @BJPMahilaMorcha
Principal - Sevasadan D.L.Ed. College, Pune"
222,True,Mysuru-Kodagu(Coorg) ,113568312,https://t.co/uG6vGWq8cD,"{'followers_count': 361076, 'following_count': 926, 'tweet_count': 32712, 'listed_count': 288}",False,BJP,mepratap,Pratap Simha,2010-02-12T07:18:05.000Z,Columnist | Appa | Husband | BJP Worker | Member of Parliament
223,True,Amritsar - Varanasi - Mumbai ,328561692,https://t.co/v49mNSqNkB,"{'followers_count': 91644, 'following_count': 1468, 'tweet_count': 28134, 'listed_count': 46}",False,BJP,mohitbharatiya_,Mohit Kamboj Bharatiya - मोहित कंबोज भारतीय,2011-07-03T16:22:15.000Z,Proud Father | Husband | Nationalist | Sanatani | Passionate Politician | Entrepreneur  | Law Student | Bike Rider | Warrior | Adventurer | Mahadev !
224,True,"Meerut, Uttar Pradesh",2281013472,https://t.co/Y7Z3BN7e3q,"{'followers_count': 30958, 'following_count': 233, 'tweet_count': 45293, 'listed_count': 61}",False,BJP,MP_Meerut,Rajendra Agrawal,2014-01-07T18:42:03.000Z,"⭐️Elected 3 times in a row as सांसद / M.P. of Meerut-Hapur (U.P.)  ⭐️Chairperson - Committee on Govt. Assurances ⭐️Member - Panel of Chairpersons, Lok Sabha"
225,False,"Dindori, India Mumbai Delhi",875266297365266433,https://t.co/MvacUDCCTl,"{'followers_count': 1866, 'following_count': 259, 'tweet_count': 1959, 'listed_count': 14}",False,BJP,mpharishchandra,Harishchandra Chavan,2017-06-15T08:18:41.000Z,"Former 3 Term MP - Dindori Loksabha | Member @BJP4Maharashtra | Member, Committee on Members of Parliament Local Area Development Scheme (MPLADS)"
226,True,"Mumbai, Maharashtra",1479387656,https://t.co/EPomo8Xepv,"{'followers_count': 33461, 'following_count': 287, 'tweet_count': 5766, 'listed_count': 48}",False,BJP,MPLodha,Mangal Prabhat Lodha,2013-06-03T10:27:40.000Z,"President, Bharatiya Janata Party - Mumbai @BJP4Mumbai | MLA, Malabar Hill, Mumbai."
227,True,"Jabalpur, India",2789633743,https://t.co/Rl6CU5mno0,"{'followers_count': 234363, 'following_count': 464, 'tweet_count': 24779, 'listed_count': 98}",False,BJP,MPRakeshSingh,Rakesh Singh,2014-09-04T11:12:32.000Z,"Member of Parliament for Jabalpur Constituency | Chief Whip (Lok Sabha) | Chairperson, Standing Committee on Coal and Steel"
228,True,"Gujarat, India",2890923547,https://t.co/6eYEg7dVUq,"{'followers_count': 45179, 'following_count': 172, 'tweet_count': 34820, 'listed_count': 93}",False,BJP,mpvadodara,Ranjan Bhatt (MP),2014-11-05T14:39:20.000Z,"02nd Term - Member of Parliament (MP) of Vadodara. 
Ex Deputy Mayor of Vadodara Municipal Corporation (VMC). 
1st Female President - Vadodara BJP."
229,True,"Maharashtra, India",85657578,https://t.co/2i8p2Savzz,"{'followers_count': 498509, 'following_count': 1579, 'tweet_count': 102057, 'listed_count': 699}",False,BJP,MrsGandhi,Priti Gandhi - प्रीति गांधी,2009-10-27T20:43:25.000Z,BJP Karyakarta.
230,True,"Founder: Ummah TV, UK",480457324,https://t.co/Qp53W20JwP,"{'followers_count': 21179, 'following_count': 557, 'tweet_count': 4184, 'listed_count': 30}",False,BJP,MSufiSaint,Dr Sufi M K Chishty,2012-02-01T14:32:01.000Z,"National Gen Sec BJP Minority
Chairman GMFDC
Spiritual Priest.
https://t.co/pvntPF5w6m Elect, MCA. Ph.D.
Chief Advisor World Peace Centre USA.
Hon PM @narendramodi follows me"
231,True,Surat Gujarat,409218445,https://t.co/E4A45Y3hwe,"{'followers_count': 19049, 'following_count': 1385, 'tweet_count': 11112, 'listed_count': 43}",False,BJP,mukeshpatelmla,Mukesh Patel,2011-11-10T12:44:40.000Z,"Minister of State for Agriculture, Energy and Petrochemicals. MLA from Olpad Constituency, Karyakarta @Bjp4Gujarat."
